"Verification of embedded system's specification using collaborative simulation of SysML and simulink models","R. Kawahara; D. Dotan; T. Sakairi; Kohichi Ono; Hiroaki Nakamura; A. Kirshin; Shinichi Hirose; Hiroshi Ishikawa","Tokyo Research Laboratory, IBM Research GmbH, Yamato, Kanagawa, Japan; Tokyo Research Laboratory, IBM Research GmbH, Japan; Haifa Research Laboratory, IBM Research GmbH, Japan; Haifa Research Laboratory, IBM Research GmbH, Japan; Tokyo Research Laboratory, IBM Research GmbH, Japan; Tokyo Research Laboratory, IBM Research GmbH, Japan; Tokyo Research Laboratory, IBM Research GmbH, Japan; Tokyo Research Laboratory, IBM Research GmbH, Japan","2009 International Conference on Model-Based Systems Engineering","29 May 2009","2009","","","21","28","The authors propose an extension of SysML which enables description of continuous-time behavior. The authors also develop its execution tool integrated on Eclipse-based platform by exploiting co-simulation of SysML and MATLAB / Simulink. To demonstrate the effectiveness of the tool and the extension to SysML in verifying specifications of an embedded system, we create a sample model and analyze its execution results by checking constraints under a test case.","","978-1-4244-2967-7","10.1109/MBSE.2009.5031716","","https://ieeexplore.ieee.org/stamp/stamp.jsp?arnumber=5031716","","Embedded system;Collaboration;Unified modeling language;Mathematical model;MATLAB;Joining processes;System testing;Systems engineering and theory;Binary decision diagrams;Connectors","digital simulation;embedded systems;formal specification;formal verification;specification languages","embedded system specification;system verification;collaborative simulation;SysML;continuous-time behavior;execution tool;Eclipse based platform;constraint checking","","36","2","12","IEEE","29 May 2009","","","IEEE","IEEE Conferences"
"Scheduling appointments via fluids control","Y. Luzon; A. Mandelbaum; M. Penn","Industrial Engineering and Management, Technion-Israel Institute of Technology, Haifa, Israel; Industrial Engineering and Management, Technion-Israel Institute of Technology, Haifa, Israel; Industrial Engineering and Management, Technion-Israel Institute of Technology, Haifa, Israel","2009 International Conference on Model-Based Systems Engineering","29 May 2009","2009","","","29","35","In this research a fluid based appointment book is designed to be used for managing appointment systems. We propose a deterministic fluid control approach for modeling a stochastic single server appointment system with several types of customers. Optimal control functions for the minimum average waiting time objective are presented and used to suggest a scheduling heuristic. The heuristic is then used for constructing our appointment book for scheduling customers in the original stochastic system. We demonstrate the performance of the obtained schedule using simulations.","","978-1-4244-2967-7","10.1109/MBSE.2009.5031717","","https://ieeexplore.ieee.org/stamp/stamp.jsp?arnumber=5031717","","Books;Job shop scheduling;Stochastic systems;Optimal control;Engineering management;History;Stochastic processes;Control systems;Industrial engineering;Resource management","optimal control;queueing theory;scheduling;stochastic systems","scheduling appointments;fluid based appointment book;deterministic fluid control;stochastic single server appointment system;optimal control functions;minimum average waiting time objective","","3","","17","IEEE","29 May 2009","","","IEEE","IEEE Conferences"
"Review on Domain Specific Systems Engineering","C. Neureiter; C. Binder; G. Lastro","Center for Secure Energy Informatics Salzburg, University of Applied Sciences, Salzburg, Austria; Center for Secure Energy Informatics Salzburg, University of Applied Sciences, Salzburg, Austria; Center for Secure Energy Informatics Salzburg, University of Applied Sciences, Salzburg, Austria","2020 IEEE International Symposium on Systems Engineering (ISSE)","4 Dec 2020","2020","","","1","8","The ongoing integration of connectivity and automation in cyber-physical systems (CPS) drives the need for innovative engineering concepts. Especially the aspect of dependability by design comes into focus. A suitable approach for this task can be found in the concepts of Model Based Systems Engineering (MBSE). In practical application, however, utilization of MBSE does not meet expectations. One of the main barriers identified is the little stakeholder acceptance for common concepts such as object modelling. This aspect has been addressed in the recent past by the Domain Specific Systems Engineering (DSSE) approach. In context of DSSE, plenty of research has been conducted and different aspects were studied. To gain a holistic picture of this approach, the paper at hands contributes a review on DSSE as a whole. In a first step, the main concepts of Domain Specific Systems Engineering are summarized and the application of this approach is discussed. Subsequently, research outcomes achieved so far are consolidated and discussed in detail. On this basis, remaining issues are identified and the future agenda for research in DSSE is outlined.","2687-8828","978-1-7281-8602-3","10.1109/ISSE49799.2020.9272214","","https://ieeexplore.ieee.org/stamp/stamp.jsp?arnumber=9272214","Model Based Systems Engineering (MBSE);System-of-Systems Engineering (SoSE);Domain Specific Systems Engineering (DSSE)","Solid modeling;Analytical models;Unified modeling language;Computational modeling;Context modeling;Systems engineering and theory;Biological system modeling","cyber-physical systems;systems engineering","object modelling;dependability by design;CPS;domain specific systems engineering approach;common concepts;MBSE;model based systems engineering;innovative engineering concepts;cyber-physical systems;DSSE","","2","","57","IEEE","4 Dec 2020","","","IEEE","IEEE Conferences"
"Challenges in the modelling of SoS design alternatives with MBSE","M. Di Maio; G. . -D. Kapos; N. Klusmann; C. Allen","Projectglobe ltd., London, United Kingdom; Projectglobe ltd., London, United Kingdom; Projectglobe ltd., London, United Kingdom; Faculty of Business, Economics and Communications Naresuan University, Phitsanulok, Thailand","2016 11th System of Systems Engineering Conference (SoSE)","15 Aug 2016","2016","","","1","5","A central promise of Model-Based Systems Engineering (MBSE) is to decrease the volume of information produced during the system design lifecycle through improved structure and smarter reuse across the numerous perspectives and architectural levels. The study of variants is a core challenge within MBSE due to associated exponential information growth, and the complexity created by this extra dimensionality. Variant management has been discussed extensively for the physical layer, but lacks research focusing on functional and logical layers, particularly relevant to concept phase engineering. In System of Systems (SoS) problems, the physical choices are typically constrained by the fact that the interacting systems already exist. This paper therefore studies the implications of variant modelling for the behaviour of the SoS. It explores the possibility of developing a functional architecture that can be extended to accommodate changes due to decisions made in the logical layer. It investigates the formal aspects of including variant modelling into the Systems Modelling Language (SysML) and discusses the potential need for a language extension.","","978-1-4673-8727-9","10.1109/SYSOSE.2016.7542937","","https://ieeexplore.ieee.org/stamp/stamp.jsp?arnumber=7542937","Design alternatives engineering;variant modelling;variant control;technology-driven change management;MBSE;SoSE;SysML;configuration management","Modeling;Schedules;Biological system modeling;Physical layer;Context","SysML;systems engineering","SysML;systems modelling language;system of systems;concept phase engineering;variant management;exponential information growth;system design lifecycle;model-based systems engineering;MBSE;SoS design alternatives","","3","","13","IEEE","15 Aug 2016","","","IEEE","IEEE Conferences"
"The Design of University Staff Data Management System Based on MBSE","D. Ding; Z. Zhao","Information Center, Capital Medical University, Beijing, China; Information Center, Capital Medical University, Beijing, China","2020 15th IEEE Conference on Industrial Electronics and Applications (ICIEA)","9 Nov 2020","2020","","","1921","1925","This paper introduces the application of Model-Based Systems Engineering (MBSE) methodology in the normal conceptual design stage of data management system. With the university personnel data management system as an example, it establishes the model diagram on Rhapsody platform through Systems Modeling Language (SysML), and defines the forward design process of the key functional architecture of MBSE. From the system top-level model building to the user fuzzy demand acquisition, finally, taking data audit as an example, the activity diagram and sequence diagram models are built, which provide direct reference for software development. Because of the replacement of text description by models, this methodology realizes the full decoupling of system functions, ensuring a consistent understanding of system description by all stakeholders and accordingly the effective reduction of the system iterative cost.","2158-2297","978-1-7281-5169-4","10.1109/ICIEA48937.2020.9248413","","https://ieeexplore.ieee.org/stamp/stamp.jsp?arnumber=9248413","MBSE;system design;Rhapsody","Analytical models;Process modeling;Data models;Systems Modeling Language;Software;Stakeholders;Modeling","formal specification;fuzzy set theory;iterative methods;learning management systems;personnel;systems engineering;Unified Modeling Language","activity diagram;sequence diagram models;system iterative cost;MBSE;model-based systems engineering methodology;normal conceptual design stage;model diagram;systems modeling language;forward design process;key functional architecture;system top-level model building;user fuzzy demand acquisition;University staff data management system;University personnel data management system;Rhapsody platform;software development;text description","","1","","6","IEEE","9 Nov 2020","","","IEEE","IEEE Conferences"
"Model Based Systems Engineering (MBSE) Applied to Fault Detection Analysis of Vehicle Subsystems","N. Mahmood; S. Cimtalay; D. N. Mavris","Northrop Grumman Aeronautics Systems, San Diego, CA; Georgia Institute of Technology, Atlanta, GA; Georgia Institute of Technology, Atlanta, GA","2022 IEEE Aerospace Conference (AERO)","10 Aug 2022","2022","","","1","11","As the field of Model Based Systems Engineering (MBSE) continues to advance in the aerospace industry and far beyond, company executives in all aspects of the program lifecycle now have the opportunity to investigate and begin implementing meaningful applications of the digital thread to ideally realize time and cost savings for both current and future company efforts. One such portion of the product lifecycle often overlooked when allocating resources for digital thread implementation is the logistics and sustainment phase, which in many cases can account for the majority of the total program cost over the lifespan of the product. This paper in particular examines, as a case study, an opportunity for program sustainment to benefit directly from the digital thread by focusing on modeling subsystem block diagrams in SysML, and using those models to assess, verify, and ultimately generate deliverables assessing the Built-In-Test (BIT) capability of a given system. This information in the form of system models or paper deliverables can greatly expedite routine maintenance procedures for example by allowing technicians to quickly locate faulty cable harnesses in the field, or by enabling reliability engineers to verifiably and instantly ensure that BIT faults have complete coverage over all possible failures, including new ones resulting from costly lessons learned in operational usage. The goal of this effort is to outline a specific concept under which BIT behaviors may be modeled in SysML and how they relate to already established subsystem models, but the broader idea of the paper is to present an argument for the very tangible benefits of investing in and establishing a digital thread not just in the design phase of a program, but also across typical company silos and into the product support and sustainment organizations as well.","1095-323X","978-1-6654-3760-8","10.1109/AERO53065.2022.9843533","","https://ieeexplore.ieee.org/stamp/stamp.jsp?arnumber=9843533","","Costs;Fault detection;Process control;Companies;Maintenance engineering;Reliability engineering;Modeling","aerospace industry;fault diagnosis;fault location;maintenance engineering;production engineering computing;project management;reliability;software maintenance;systems engineering","Model Based Systems Engineering applied;MBSE;fault detection analysis;vehicle subsystems;aerospace industry;program lifecycle;meaningful applications;cost savings;current company efforts;future company efforts;product lifecycle;allocating resources;digital thread implementation;logistics;sustainment phase;total program cost;program sustainment;subsystem block diagrams;SysML;Built-In-Test capability;system models;paper deliverables;reliability engineers;BIT faults;costly lessons;subsystem models;product support;sustainment organizations","","","","15","IEEE","10 Aug 2022","","","IEEE","IEEE Conferences"
"Creating a Digital Twin of an Insider Threat Detection Enterprise Using Model-Based Systems Engineering","J. Lee; A. Alghamdi; A. K. Zaidi","Dept. of System Engineering and Operations Research, George Mason University; Dept. of System Engineering and Operations Research, George Mason University; Dept. of System Engineering and Operations Research, George Mason University","2022 IEEE International Systems Conference (SysCon)","16 May 2022","2022","","","1","7","Inference Enterprise Modeling (IEM) is a methodology developed to address test and evaluation limitations that insider threat detection enterprises face due to a lack of ground truth and/or missing data. IEM uses a collection of statistical, data processing, analysis, and machine learning techniques to estimate and forecast the performance of these enterprises. As part of developing the IEM method, models satisfying various detection system evaluation requirements were created. In this work, we extend IEM as a digital twin generation technique by representing modeled processes as executable UML Activity Diagrams and tracing solution processes to problem requirements using ontologies. Using the proposed framework, we can rapidly prototype a digital twin of a detection system that can also be imported and executed in systems engineering simulation software tools such as Cameo Enterprise Architecture Simulation Toolkit. Cyber security and threat detection is a continuous process that requires regular maintenance and testing throughout its lifecycle, but there often exists access issues for sensitive and private data and proprietary detection model details to perform adequate test and evaluation activities in the live production environment. To solve this issue, organizations can use a digital twin technique to create a real-time virtual counterpart of the physical system. We describe a method for creating digital twins of live and/or hypothetical insider threat detection enterprises for the purpose of performing test and evaluation activities on continuous monitoring systems that are sensitive to disruptions. In this work, we use UML Activity Diagrams to leverage the integrated simulation capabilities of Model-Based Systems Engineering (MBSE).","2472-9647","978-1-6654-3992-3","10.1109/SysCon53536.2022.9773890","","https://ieeexplore.ieee.org/stamp/stamp.jsp?arnumber=9773890","Digital Twin;MBSE;Insider Threat;System Engineering","Digital twin;Unified modeling language;Prototypes;Production;Organizations;Ontologies;Data models","business data processing;learning (artificial intelligence);ontologies (artificial intelligence);security of data;software tools;systems engineering;Unified Modeling Language","evaluation activities;continuous monitoring systems;model-based systems engineering;inference enterprise modeling;evaluation limitations;data processing;IEM method;detection system evaluation requirements;digital twin generation technique;modeled processes;tracing solution processes;systems engineering simulation software tools;sensitive data;private data;proprietary detection model details;digital twin technique;physical system;live insider threat detection enterprises;hypothetical insider threat detection enterprises;Cameo enterprise architecture simulation toolkit;executable UML activity diagrams;insider threat detection enterprise;MBSE","","1","","25","IEEE","16 May 2022","","","IEEE","IEEE Conferences"
"Streamlining the development of complex systems through model-based systems engineering","H. -P. Hoffmann","IBM Rational Software, Littleton, MA, USA","2012 IEEE/AIAA 31st Digital Avionics Systems Conference (DASC)","20 Dec 2012","2012","","","6E6-1","6E6-8","Delivering complex systems requires the development of optimal designs on time, within budget and with the right level of quality. But even the best detailed design cannot compensate for poor system architecture. Systems engineering is not just a technical activity in the lifecycle - it determines the commercial viability of the entire project. The state-of the art answer to these challenges is Model-based Systems Engineering. This article introduces IBM Rational® Best Practices for Model-based Systems Engineering. Using the UML/SysML as a paradigm-independent modeling language, these practices support the elaboration and verification/validation of system requirements as well as design synthesis through model execution. But modeling is not the solution alone. The key for a successful application of the MbSE paradigm is the up-front defining of the underlying workflow; that is where systems engineering stops and where artifacts are handed off to the hardware, software and test engineers. From these pre- and post-conditions the necessary intermediate artifacts and supporting best practices - that are needed to elaborate the agreed upon hand-off - are derived. This article describes an exemplary systems engineering workflow covering the requirements analysis, system functional analysis, and design synthesis phases plus the essential tasks, associated work products and supporting best practices. Collaborative aspects of the systems engineering lifecycle: requirements engineering and change management, will also be addressed.","2155-7209","978-1-4673-1700-9","10.1109/DASC.2012.6382404","","https://ieeexplore.ieee.org/stamp/stamp.jsp?arnumber=6382404","","Analytical models;Computer architecture;Functional analysis;Unified modeling language;Software","formal specification;formal verification;systems analysis;systems engineering","complex system;model-based system engineering;optimal design;technical activity;UML;SysML;paradigm-independent modeling language;system requirement verification;system requirement validation;MbSE paradigm;requirements analysis;system functional analysis;design synthesis phase;associated work products;systems engineering lifecycle;change management;IBM Rational","","7","","4","IEEE","20 Dec 2012","","","IEEE","IEEE Conferences"
"Integrating Reliability Engineering with Model Based Systems Engineering","M. W. Daniels; K. Pierre",Lockheed Martin; Lockheed Martin,"2023 Annual Reliability and Maintainability Symposium (RAMS)","5 Apr 2023","2023","","","1","6","Summary & ConclusionsAs fully digital programs become commonplace, it is imperative that Reliability Engineering (RE) adapt to take advantage of all the benefits that Model-Based Systems Engineering (MBSE) offers. At the same time, integrating RE with MBSE cannot result in a loss of modeling and prediction fidelity, nor should it drive significant learning on reliability engineers of new tools and programming languages. The approach should, however, consider the particular nuances of the modeling being performed. This paper describes two distinct techniques for this integration effort adopted by two program areas within the same company. Both approaches contain unique advantages, and it is shown that there is no single best way to perform RE within an MBSE framework.The first approach described performs the reliability analysis in a Microsoft Excel based model. The important properties of the system hardware are captured in a table in Cameo. This table is then exported to Excel and compared to the hardware in the Excel reliability model. Once any hardware changes have been updated, the table can be exported back to Cameo to include the updated reliability properties.The second approach described integrates MATLAB with Cameo. The reliability analysis is either performed in MATLAB or another tool then integrated into MATLAB. Then, through a series of scripts, Cameo connects with the MATLAB analysis to fully integrate the system model with the reliability model.Each of these approaches can be used by a wide variety of programs in diverse industries. The appeal of these approaches is that it allows Reliability Engineers to continue using their current tools while ensuring that their models always align with the current system architecture.","2577-0993","978-1-6654-6053-8","10.1109/RAMS51473.2023.10088275","","https://ieeexplore.ieee.org/stamp/stamp.jsp?arnumber=10088275","MBSE;Digital Tapestry;Reliability Modeling;R&M Management","Industries;Analytical models;Adaptation models;Systems architecture;Reliability engineering;Mathematical models;Hardware","","","","","","9","IEEE","5 Apr 2023","","","IEEE","IEEE Conferences"
"A Novel Approach to Behavior Design for Model Based Systems Engineering Application Using Design Structure Matrix","A. Akundi; T. -L. B. Tseng; C. N. Almeraz; R. J. Lopez-Terrazas; H. Luan","Complex Engineering Systems Laboratory, The University of Texas Rio Grande Valley, Brownsville, Texas; Department of Industrial, Manufacturing, and Systems Engineering, The University of Texas at El Paso, El Paso, Texas; Department of Industrial, Manufacturing, and Systems Engineering, The University of Texas at El Paso, El Paso, Texas; Department of Industrial, Manufacturing, and Systems Engineering, The University of Texas at El Paso, El Paso, Texas; Avionics Engineering Department Mission Systems Group, Naval Air Warfare Center Aircraft Division, Patuxent River, MD","2021 IEEE International Systems Conference (SysCon)","9 Jun 2021","2021","","","1","7","Model-Based Systems Engineering (MBSE) is the formalized application of modeling to support various system evolving stages starting from the conceptual design phase to all the life cycle phases that follow. To facilitate in an efficient system behavior design process, in this paper, a Design Structure Matrix (DSM) based approach is developed and illustrated for determining the operational sequence of activities relevant to requirements of the system and in identifying the concurrent activities as well. A triangularization algorithm method is extended especially for application on activity diagrams to determine knowledge activities in an interaction graph to identify groups of activities and arrange them concurrently. The findings through the DSM based approach are validated by a system engineering expert and are implemented to construct the MBSE activity diagram to facilitate an enhanced behavior design of the system. This paper illustrates the use of Design Structure Matrix to facilitate modeling interdependencies between activities and the approach to aggregate the resulted sequential and concurrent activities with the activity diagram, applied to a case study of Execute Hohmann Transfer based on DellSat-77 Satellite System. In addition, the potentials benefits of using a Design Structure Matrix methodology for assisting Model Based Systems Engineering activities for enhanced systems behavior design is portrayed.","2472-9647","978-1-6654-4439-2","10.1109/SysCon48628.2021.9447074","National Science Foundation; ","https://ieeexplore.ieee.org/stamp/stamp.jsp?arnumber=9447074","MBSE;DSM;SysML;Triangularization;Activity Diagram;Systems Engineering;Model-Based Systems;DellSat-77","Industries;Satellites;Aggregates;Design methodology;Conferences;Manufacturing;Modeling","design engineering;matrix algebra;product life cycle management;systems analysis;systems engineering","execute hohmann transfer;interaction graph;triangularization algorithm method;support various system;model based systems engineering application;design structure matrix methodology;MBSE activity diagram;system engineering expert;DSM based approach;knowledge activities;efficient system behavior design process;life cycle phases;conceptual design phase;DellSat-77 Satellite System;concurrent activities;enhanced behavior design","","1","","17","IEEE","9 Jun 2021","","","IEEE","IEEE Conferences"
