"Internet of Things Canvas for Ideation in Model-Based Product Generation Planning","A. A. Albers; R. Bernijazov; L. Kaiser; R. Dumitrescu","Product Engineering, Fraunhofer Institute for Mechatronic Systems Design IEM, Paderborn, Germany; Product Engineering, Fraunhofer Institute for Mechatronic Systems Design IEM, Paderborn, Germany; Product Engineering, Fraunhofer Institute for Mechatronic Systems Design IEM, Paderborn, Germany; Advanced Systems Engineering (ASE), University of Paderborn, Paderborn, Germany","2018 13th Annual Conference on System of Systems Engineering (SoSE)","9 Aug 2018","2018","","","327","334","Product generation planning deals with the strategic planning of new product generations. An important task of this procedure is to find ideas for new product features based on an existing reference product. In industrial practice, usually technical models of the reference product (e.g. CAD models) are employed in the scope of product feature ideation. However, these models alone do not provide sufficient information for the identification of new Internet of Things (IoT) features. These features require the consideration of the available flows, the utilized communication technologies, and the surrounding System of Systems (SoS). A potential solution for this problem is provided by Model-Based Systems Engineering (MBSE). MBSE provides a holistic system model that describes the logical architecture as well as the environment of the reference product. However, there is a lack of methodological support for the utilization of system models in the scope of strategic product planning. This paper presents a novel method for IoT feature ideation based on the system model of a reference product. The core of this method is the so-called IoT canvas, which constitutes an IoT-specific view on the system model of the reference product. It can be systematically derived from the system model and serves as the starting point for product feature ideation. The presented method was evaluated in the scope of an innovation project with a German manufacturing company and showed high potential for industrial practice.","","978-1-5386-4876-6","10.1109/SYSOSE.2018.8428722","","https://ieeexplore.ieee.org/stamp/stamp.jsp?arnumber=8428722","Model-Based Systems Engineering;Product Generation Engineering PGE;Cyber-Physical Systems CPS;Industry 4.0;Fuzzy front-end;Early phase of innovation process;Release planning;Innovation management;Advanced Systems Engineering;Workshop approach;Methodology;Product planning","Unified modeling language;Solid modeling;Planning;Production systems;Printing","Internet;Internet of Things;manufacturing industries;production engineering computing;production planning;strategic planning;systems engineering","product feature ideation;Model-Based Systems Engineering;holistic system model;strategic product planning;IoT feature ideation;Model-Based product generation planning;reference product;Internet of Things features;logical architecture;IoT canvas;German manufacturing company","","1","","27","IEEE","9 Aug 2018","","","IEEE","IEEE Conferences"
"Towards A Service-oriented Framework for MBSE Tool-chain Development","J. Lu; D. Chen; J. Wang; M. Torngren","KTH Royal Institute of Technology, Stockholm; KTH Royal Institute of Technology, Stockholm; University of Electronic Science and Technology, China; KTH Royal Institute of Technology, Stockholm","2018 13th Annual Conference on System of Systems Engineering (SoSE)","9 Aug 2018","2018","","","568","575","This paper proposes a SPIRIT framework supporting model-based systems engineering (MBSE) tool-chain development of advanced cyber-physical systems (CPS) with emphasis on tool integration, process management, automated verification and validation. The core features of the developed MBSE tool-chain include domain-specific modeling to describe CPS development, service-oriented deployment of technical resources (data, model and tool operations) and process management through IT platforms. The framework has two purposes: to support tool-chain development with a systems engineering approach; to promote interoperability of the whole developed tool-chain through a service-oriented approach. The framework covers social, process, information and technical aspects aiming to integrate various related MBSE techniques with tool-chain development. Based on the framework, an MBSE tool-chain prototype is developed, and the flexibility and interoperability are evaluated through a case study.","","978-1-5386-4876-6","10.1109/SYSOSE.2018.8428746","","https://ieeexplore.ieee.org/stamp/stamp.jsp?arnumber=8428746","MBSE;Tool-chain development;Process management;Tool integration;Service orchestration","Unified modeling language;Tools;Task analysis;Mathematical model;Stakeholders;Data models","embedded systems;formal verification;open systems;software architecture;software tools;systems engineering;Web services","CPS development;service-oriented deployment;process management;developed tool-chain;service-oriented approach;related MBSE techniques;MBSE tool-chain prototype;service-oriented framework;MBSE tool-chain development;advanced cyber-physical systems;tool integration;developed MBSE tool-chain;system engineering approach;SPIRIT framework;model-based system engineering tool-chain development","","4","","21","IEEE","9 Aug 2018","","","IEEE","IEEE Conferences"
"Development of a Low Powered Wireless IoT Sensor Network based on MBSE","J. Taha; V. Salehi; F. Abraham","Department of Applied Sciences and Mechatronics, Munich University of Applied Science, Munich, Germany; Department of Applied Sciences and Mechatronics, Munich University of Applied Science, Munich, Germany; Associate Professor Mechanical & Marine Engineering, University of Plymouth, Plymouth, England","2018 IEEE International Systems Engineering Symposium (ISSE)","29 Nov 2018","2018","","","1","8","Nowadays, the trend in System Engineering (SE) is shifting more and more in the domains of Wireless Sensor Networks (WSN) and Internet of Things (IoT) and will reach new height in demand. The complexity of those systems which are fundamentally different from those of the last decades in their own areas and are furthermore growing. To fulfil all requirements in those fields, a wider range of functionalities and components are needed, especially for IoT systems. In the interdisciplinary development, many conflicts occur. Thus, the complexity of the product demands a change of the development process itself. Most approaches lack in aspects of transparency, traceability and continuous development in general. Therefore, a neutral systematic approach is needed, which model-based systems engineering (MBSE) could provide. This paper applied MBSE in the domain of IoT in WSN development. Although MBSE emerged from system engineering/development, it essentially allows any developer in any discipline to understand relations between different system components in the central system model. The stages of this research are not fully developed yet but a high potential is expected. This holistic central system model is described by MBSE with tool, modelling language and method. The most promising modelling language for an interdisciplinary work in a real industrial content is SysML, which will be applied throughout the modelling tool following the RFLP principle of the V-model. These endeavours will then represent our result to show a more transparent continuous traceable solution in comparison with the existing application.","","978-1-5386-4446-1","10.1109/SysEng.2018.8544420","","https://ieeexplore.ieee.org/stamp/stamp.jsp?arnumber=8544420","MBSE;SysML;IoT;WSN;V-Model;RFLP;Cameo System Modeler","Peer-to-peer computing;Wireless sensor networks;Modeling;Unified modeling language;Tools;Network topology","Internet of Things;systems engineering;wireless sensor networks","IoT systems;interdisciplinary development;continuous development;neutral systematic approach;model-based systems engineering;MBSE;WSN development;holistic central system model;V-model;transparent continuous traceable solution;wireless sensor networks;low powered wireless IoT sensor network;RFLP principle","","2","","36","IEEE","29 Nov 2018","","","IEEE","IEEE Conferences"
"Impact of the MBSE on the design of a mechatronic flywheel-based energy storage system","E. Brusa; D. Ferretto","Department of Mechanical and Aerospace Engineering, Politecnico di Torino, Torino, Italy; Department of Mechanical and Aerospace Engineering, Politecnico di Torino, Torino, Italy","2016 IEEE International Symposium on Systems Engineering (ISSE)","24 Nov 2016","2016","","","1","8","The design of a flywheel system for energy storage is herein performed through the Model Based Systems Engineering (MBSE) as an example of mechatronic product development and innovation. Some relevant advantages of the MBSE applied to a material mechatronic system, in some activities, as the requirement analysis, the identification of system capabilities, the definition of architecture and the system validation are identified. Moreover, the paper is aimed at investigating some critical issues arising when the MBSE tools are applied to machine design, being still a domain poorly inclined to exploit this holistic approach. That trend might be related to technical difficulties in assessing an interoperable framework of simulators aimed at dealing simultaneously with functional and physical models. In addition the technology scouting looks poorly connected within the standard SysML diagrams, without introducing some additional charts. A demonstration of the fruitful impact of the MBSE on the machine design is herein proposed, to show some advantages provided as a mechatronic integrated system is conceived and how a complete trade-off analysis could be supported by the MBSE modeling activity.","","978-1-5090-0793-6","10.1109/SysEng.2016.7753145","","https://ieeexplore.ieee.org/stamp/stamp.jsp?arnumber=7753145","Model Based Systems Engineering;flywheel based energy storage systems;SysML modeling;trade-off analysis;heterogeneuous simulation","Mechatronics;Flywheels;Modeling;Technological innovation;Functional analysis;Magnetic levitation","electric machines;flywheels;mechatronics;power engineering computing;systems engineering","MBSE impact;mechatronic flywheel based energy storage system design;model based system engineering;material mechatronic system;machine design;interoperable framework;SysML diagram;mechatronic integrated system","","1","","21","IEEE","24 Nov 2016","","","IEEE","IEEE Conferences"
"MBSE Challenges in the Concurrent Preliminary Design of CubeSats: Nanospace Study","S. S. Cordero; T. Gateau; R. Vingerhoeds","ISAE-SUPAERO, Université de Toulouse, Toulouse, France; ISAE-SUPAERO, Université de Toulouse, Toulouse, France; ISAE-SUPAERO, Université de Toulouse, Toulouse, France","2022 IEEE International Systems Conference (SysCon)","16 May 2022","2022","","","1","8","In this paper, the early endeavours of the incorporation of a Model-based Systems Engineering (MBSE) approach to the open-source Nanospace framework is discussed, presenting the challenges that need to be overcome for such an integration. Nanospace is a web application dedicated to facilitate concurrent engineering during the preliminary design phase of CubeSats. CubeSats provide a progression of educational and research opportunities, and have had increased the accessibility to space for non-space fairing nations. CubeSats and their subsystems interfaces have been studied numerous times. Nanospace may benefit from MBSE, as MBSE facilitates knowledge reuse; which could allow a faster design convergence and faster inspection of candidate architectures.","2472-9647","978-1-6654-3992-3","10.1109/SysCon53536.2022.9773818","","https://ieeexplore.ieee.org/stamp/stamp.jsp?arnumber=9773818","CubeSats;MBSE;Preliminary Design;Concurrent Engineering (CE)","Knowledge engineering;Databases;Memory;User interfaces;Nanostructures;CubeSat;Modeling","aerospace computing;artificial satellites;concurrent engineering;inspection;Internet;systems engineering","MBSE challenges;concurrent preliminary design;CubeSats;model-based systems engineering;open-source nanospace framework;Web application;concurrent engineering;preliminary design phase;nonspace fairing nations;design convergence","","","","42","IEEE","16 May 2022","","","IEEE","IEEE Conferences"
"XMI-Based SysML Model Transformation","Y. Li; H. Zhang; J. Lv; Y. Liu","State Key Lab of CAD/CG, HangzhouHope System Technology, Zhejiang University, Hangzhou, China; China Manned Space Agency, Beijing, China; China Astronaut Research and Training Center, Beijing, China; State Key Lab of CAD/CG, HangzhouHope System Technology, Zhejiang University, Hangzhou, China","2022 7th International Conference on Control, Robotics and Cybernetics (CRC)","15 Feb 2023","2022","","","74","77","With the development and progress of Model-Based Systems Engineering (MBSE), it has gradually replaced the traditional text-based methods and has been widely used. Systems Modeling Language (SysML) is the de facto standard for MBSE approaches. However, there are various SysML-based system engineering modeling softwares, transformation of heterogeneous data from various softwares become an urgent need to meet. Here, we base on the XMI standard and the system engineering modeling software M-Design, achieve transformation from the XMI format file to the objects design according to SysML language. Firstly, we analyze a XMI format file structure, and secondly design a transformation solution according to analysis and SysML standard. After transformation, we compare result project and the original one to check consistency. With this method, heterogeneous data from different software can be communicated easily.","","978-1-6654-7306-4","10.1109/CRC55853.2022.10041202","National Key Research and Development Program of China(grant numbers:2018YFB1700901); National Science Foundation of China(grant numbers:61873236); ","https://ieeexplore.ieee.org/stamp/stamp.jsp?arnumber=10041202","MBSE;UML;SysML;XMI;Heterogeneous data transformation","Analytical models;Text analysis;Unified modeling language;Maintenance engineering;Software;Systems Modeling Language;Data models","distributed databases;SysML;systems engineering","heterogeneous data;MBSE approaches;model-based systems engineering;SysML language;system engineering modeling software M-design;systems modeling language;text-based methods;XMI-based SysML model transformation","","","","11","IEEE","15 Feb 2023","","","IEEE","IEEE Conferences"
"Plant modeling based on SysML domain specific language","T. Lee; J. -M. Cha; J. -Y. Kim; J. Shin; J. Kim; C. Yeom","Plant Systems Engineering Team, Institute for Advanced Engineering(IAE), Yong-in, Korea; Plant Systems Engineering Team, Institute for Advanced Engineering(IAE), Yong-in, Korea; Plant Systems Engineering Team, Institute for Advanced Engineering(IAE), Yong-in, Korea; Plant Systems Engineering Team, Institute for Advanced Engineering(IAE), Yong-in, Korea; Plant Systems Engineering Team, Institute for Advanced Engineering(IAE), Yong-in, Korea; Plant Systems Engineering Team, Institute for Advanced Engineering(IAE), Yong-in, Korea","2017 IEEE International Systems Engineering Symposium (ISSE)","30 Oct 2017","2017","","","1","5","Successful implementation of Model-based Systems Engineering(MBSE) obviously needs a model supporting efficient communication among engineers of various domains. The system modeling language standard, SysML is designed to create MBSE supporting models. However, SysML itself is not practical enough to be used for real-world engineering projects. As SysML is designed for generic systems and requires specialized knowledge, a model written in SysML has a limited capability to support communication between a systems engineer and a subsystem engineer. Our research's main goal is to develop a SysML based plant model integrating most outputs from plant design phases. As mentioned, a standard SysML based plant model is not specific enough to be understood by plant engineers. To make the SysML model more practical, a customized SysML for the plant engineering domain is required. Unfortunately, current researches on SysML Domain Specific Language(DSL) for the plant engineering industry are still on the early stage. So, as a pilot, we have developed our own SysML-based Piping & Instrumentation Diagram (P&ID) creation environment and P&ID itself for a specific plant system, via widely known SysML modeling tool called MagicDraw. P&ID is one of the most important output during the plant design phase, which contains all information for the plant construction phase. So a SysML based P&ID has a great potential to bridge gaps between plant engineers.","","978-1-5386-3403-5","10.1109/SysEng.2017.8088289","","https://ieeexplore.ieee.org/stamp/stamp.jsp?arnumber=8088289","MBSE;SysML;SysML Domain Specific Language;P&ID","Unified modeling language;Mathematical model;DSL;Solid modeling;Standards;Prototypes","SysML","SysML domain specific language;model-based systems engineering;MBSE;DSL;MagicDraw","","","","6","IEEE","30 Oct 2017","","","IEEE","IEEE Conferences"
"Model-Based Interoperability Engineering in Systems-of-Systems and Civil Aviation","Y. Mordecai; O. Orhof; D. Dori","Technion—Israel Institute of Technology, Haifa, Israel; Center for Academic Studies, Or-Yehuda, Israel; Technion—Israel Institute of Technology, Haifa, Israel","IEEE Transactions on Systems, Man, and Cybernetics: Systems","15 Mar 2018","2018","48","4","637","648","Interoperability is the capability of multiple parties and systems to collaborate and exchange information and matter to obtain their objectives. Interoperability challenges call for a model-based systems engineering approach. This paper describes a conceptual modeling framework for model-based interoperability engineering (MoBIE) for systems of systems, which integrates multilayered interoperability specification, modeling, architecting, design, and testing. Treating interoperability infrastructure as a system in its own right, MoBIE facilitates interoperability among agents, processes, systems, services, and interfaces. MoBIE is founded on ISO 19450 standard-object-process methodology, a holistic paradigm for modeling and architecting complex, dynamic, and multidisciplinary systems-and allows for synergistic integration of the interoperability model with system-centric models. We also discuss the implementation of MoBIE with the unified modeling language. We discuss the importance of interoperability in the civil aviation domain, and apply MoBIE to analyze the passenger departure process in an airport terminal as a case-in-point. The resulting model enables architectural and operational decision making and analysis at the system-of-systems level and adds significant value at the interoperability engineering program level.","2168-2232","","10.1109/TSMC.2016.2602543","Gordon Center for Systems Engineering at the Technion—Israel Institute of Technology, Haifa, Israel; ","https://ieeexplore.ieee.org/stamp/stamp.jsp?arnumber=7571127","Airport terminals;interoperability;model-based systems engineering (MBSE);object process methodology (OPM);systems-of-systems (SoS)","Interoperability;Unified modeling language;Atmospheric modeling;Business;Ontologies","airports;avionics;decision making;formal specification;object-oriented programming;open systems;systems engineering;Unified Modeling Language","interoperability engineering program level;systems-of-systems;conceptual modeling framework;MoBIE;multilayered interoperability specification;interoperability model;system-centric models;unified modeling language;civil aviation domain;model-based systems engineering;model-based interoperability engineering;object-process methodology;passenger departure process analysis;decision making","","21","","49","IEEE","19 Sep 2016","","","IEEE","IEEE Journals"
"Towards a System-of-Systems Architecture Definition enabling Cross-Domain Embedded Vehicle Engineering","B. Brankovic; C. Binder; D. Draxler; C. Neureiter","Center for Secure Energy Informatics, Salzburg University of Applied Sciences, Puch/Salzburg, Austria; Center for Secure Energy Informatics, Salzburg University of Applied Sciences, Puch/Salzburg, Austria; Center for Secure Energy Informatics, Salzburg University of Applied Sciences, Puch/Salzburg, Austria; Center for Secure Energy Informatics, Salzburg University of Applied Sciences, Puch/Salzburg, Austria","2021 26th IEEE International Conference on Emerging Technologies and Factory Automation (ETFA )","30 Nov 2021","2021","","","01","06","Engineering of vehicular embedded systems is a difficult task, as the ongoing integration of Cyber-physical Systems (CPS) or automation potentials during vehicle development leads to increasing complexity. In particular, to develop current or future Electric Vehicles (EV) is challenging due to different domains to consider while engineering the sub-components of the vehicle itself. Thus, in order to enable a mutual development of vehicular embedded systems on multiple abstraction levels, the Software Platform Embedded Systems (SPES) has been introduced. To cope with the complexity, this framework introduces viewpoints and hierarchy layers in shape of a matrix. However, while additionally multiple domains have to be considered when developing an EV, the SPES methodology is also missing specifications, impeding its application in actual industrial scenarios. To deal with both of the mentioned issues, this paper introduces an approach for Model-based Systems Engineering of electric vehicle systems based on SPES. By doing so, this framework is further refined by an architecture definition based on the ISO 42010 and a corresponding development process. By utilizing the EV use case, the outcome is thereby validated towards its industrial feasibility, which will enhance the applicability of SPES on the one hand and contribute to the Automotive area by dealing with the increasing complexity while engineering vehicular embedded systems on the other hand.","","978-1-7281-2989-1","10.1109/ETFA45728.2021.9613405","","https://ieeexplore.ieee.org/stamp/stamp.jsp?arnumber=9613405","System Architecture;ISO 42010;Software Platform Embedded Systems (SPES);Electric Vehicle Charging;Model-based Systems Engineering (MBSE)","Embedded systems;Shape;ISO Standards;Computer architecture;Electric vehicles;Software;Complexity theory","cyber-physical systems;electric vehicles;matrix algebra;power engineering computing;software engineering;systems engineering","automation potentials;vehicle development;EV;mutual development;multiple abstraction levels;software platform embedded systems;SPES;model-based systems engineering;electric vehicle systems;engineering vehicular embedded systems;cross-domain embedded vehicle engineering;system-of-systems architecture definition;matrix;cyber-physical systems","","1","","24","IEEE","30 Nov 2021","","","IEEE","IEEE Conferences"
"Development of System Alternatives using Generative Engineering","B. Menninger; J. Berroth; G. Jacobs","Institute for Machine Elements and Systems Engineering, RWTH Aachen University, Aachen, Germany; Institute for Machine Elements and Systems Engineering, RWTH Aachen University, Aachen, Germany; Institute for Machine Elements and Systems Engineering, RWTH Aachen University, Aachen, Germany","2022 IEEE International Symposium on Systems Engineering (ISSE)","10 Jan 2023","2022","","","1","6","The success of a company increasingly depends on its ability to master the development of highly complex systems while remaining creative and innovative. To manage the rising complexity of cyber-physical systems, Model-Based Systems Engineering (MBSE) has become a powerful approach. In MBSE systems can be abstracted by four system levels: (1) Requirements, (2) Functions, (3) Solutions and (4) Product. Each of these levels may provide alternatives to the system. The entire collection of alternatives within the solution-level (3) forms the solution-space and provides any possible solution of a system or a subsystem. Due to the dependencies between requirements, functions and solutions, to develop the entire possible solution-space of a system, the alternatives of each system level have to be combined. By analysing this entire solution-space and determining the global optimum regarding a certain indicator, e.g. cost, weight or sustainability, innovations can be achieved. Due to the high complexity of modern systems, the number of alternative systems is enormous and the identification of all alternatives is an extensive work as no alternative should be missed for a complete evaluation. Generative Engineering (GE) is an engineering approach that generates all possible alternatives of a specified system automatically. This paper will evaluate the capability of using GE to identify alternatives in systems, which are developed with the approaches of MBSE. It focuses on the generation of alternatives in the layer of functions and in the layer of solutions. The presented approach shall save a lot of time in the process of identifying alternatives in order to create a complete solutions space. This might help in the identification of global optimums and innovations.","2687-8828","978-1-6654-8182-3","10.1109/ISSE54508.2022.10005535","","https://ieeexplore.ieee.org/stamp/stamp.jsp?arnumber=10005535","Model-Based Systems Engineering;Alternatives;Generative Engineering","Technological innovation;Costs;Companies;Cyber-physical systems;Germanium;Complexity theory;Modeling","systems engineering","complex systems;cyber-physical systems;GE;generative engineering approach;MBSE systems;model-based system engineering approach","","","","23","IEEE","10 Jan 2023","","","IEEE","IEEE Conferences"
